image_id,cluster,link,host,title,clusterLabel
1317882487,hands,https://www.nbcnews.com/science/science-news/microplastics-human-body-know-dont-know-rcna23331,www.nbcnews.com,Microplastics in the human body: What we know and don't know,Hands
1317882487,hands,https://www.news-medical.net/news/20240221/Microplastics-detected-in-all-human-placenta-samples.aspx,www.news-medical.net,Microplastics detected in all human placenta samples - News-Medical,Hands
1317882487,hands,https://www.theengineer.co.uk/content/news/project-set-to-investigate-impact-of-microplastics-on-human-health/,www.theengineer.co.uk,Project set to investigate impact of microplastics on human health,Hands
1317882487,hands,https://www.independent.co.uk/climate-change/news/microplastics-human-cellsplastic-pollution-b1973033.html,www.independent.co.uk,Microplastics found to be harmful to human cells | The Independent,Hands
1317882487,hands,https://www.zonmw.nl/en/program/microplastics-health,www.zonmw.nl,Microplastics & Health - ZonMw,Hands
1317882487,hands,https://www.chemistryworld.com/news/discovery-of-microplastics-in-people-raises-difficult-questions-about-health-implications/4015516.article,www.chemistryworld.com,Discovery of microplastics in people raises concerns about health ...,Hands
1317882487,hands,https://www.architectmagazine.com/design/the-plastic-you-breathe_o,www.architectmagazine.com,The Plastic You Breathe | Architect Magazine,Hands
1390981309,hands,https://www.linkedin.com/posts/adam-root_how-new-tech-could-fix-microplastic-pollution-activity-7097488396243132418-Rk5E?trk=public_profile_like_view,www.linkedin.com,Adam Root on LinkedIn: How new tech could fix microplastic ...,Hands
1390981309,hands,https://www.iwa.wales/agenda/2024/01/microplastics-wales/,www.iwa.wales,Tackling microplastics – what more can Wales do?,Hands
1390981309,hands,https://one5c.com/microplastics-136931441/,one5c.com,What are microplastics? - one5c,Hands
1390981309,hands,https://www.channel4.com/news/how-new-tech-could-fix-microplastic-pollution-threat,www.channel4.com,How new tech could fix microplastic pollution threat – Channel 4 News,Hands
1390981309,hands,https://www.independent.co.uk/topic/microplastics,www.independent.co.uk,"microplastics - latest news, breaking stories and comment",Hands
1170923784,hands,https://www.thermofisher.com/blog/materials/identifying-and-quantifying-microplastic-pollution/,www.thermofisher.com,Microplastic Pollution Research - Thermo Fisher Scientific,Hands
1170923784,hands,https://www.megastar.do/micro-pollution-k.html,www.megastar.do,verlichten plotseling Uitdaging micro pollution Aziatisch Verwant ...,Hands
1170923784,hands,https://unfoundation.org/blog/post/protect-our-planet-from-plastic-pollution-5-things-to-know/,unfoundation.org,Protect Our Planet from Plastic Pollution: 5 Things to Know,Hands
1170923784,hands,https://www.arabnews.com/node/1632321/science-technology,www.arabnews.com,Scientists gather to study risk from microplastic pollution | Arab News,Hands
1150805328,recycle_cleaning,https://www.elgalabwater.com/blog/mapping-microplastics-river-sediment,www.elgalabwater.com,Mapping Microplastics In River Sediment - ELGA LabWater,Recycle cleaning
1150805328,recycle_cleaning,https://www.river-cleanup.org/en/news/3-out-4-belgians-are-convinced-microplastics-are-harmful-their-health,www.river-cleanup.org,3 out of 4 Belgians are convinced microplastics are harmful to their ...,Recycle cleaning
1150805328,recycle_cleaning,https://pureh2o.co.uk/microplastics-update-health-impacts-and-warnings-over-food-and-water/,pureh2o.co.uk,Microplastics update: health impacts and warnings over food and ...,Recycle cleaning
1150805328,recycle_cleaning,https://www.forbes.com/sites/allenelizabeth/2020/02/26/this-is-why-microplastics-are-so-hard-to-detect-in-the-ocean/,www.forbes.com,This Is Why Microplastics Are So Hard To Detect In The Ocean,Recycle cleaning
1150805328,recycle_cleaning,https://www.azom.com/article.aspx?ArticleID=21088,www.azom.com,Monitoring and Mitigating the Impacts of Microplastics - AZoM,Recycle cleaning
1150805328,recycle_cleaning,https://www.azocleantech.com/news.aspx?newsID=31386,www.azocleantech.com,Floating Microplastics Accumulate in the Arctic Ocean - AZoCleantech,Recycle cleaning
1150805328,recycle_cleaning,https://ediblerenotahoe.com/magazine/in-search-of-microplastics-spring20/,ediblerenotahoe.com,In Search of Microplastics - Edible Reno-Tahoe,Recycle cleaning
1150805313,recycle_cleaning,https://inhabitat.com/can-bacteria-capture-and-eliminate-microplastics/,inhabitat.com,Can bacteria capture and eliminate microplastics? - Inhabitat,Recycle cleaning
1150805313,recycle_cleaning,https://gcms.cz/webinar/2669,gcms.cz,Microplastics Characterization and Quantitation by Pyr-GC-MS,Recycle cleaning
1150805313,recycle_cleaning,https://internalhealingandwellnessmd.com/uncovering-the-human-health-impacts-of-microplastics-and-nanoplastics-on-mitochondria/,internalhealingandwellnessmd.com,Impact of Microplastics and Nanoplastics on Mitochondrial Health,Recycle cleaning
1150805313,recycle_cleaning,https://www.youtube.com/watch?v=ZOZy2OoeCFA,www.youtube.com,Scientists warn particles could travel around the body - YouTube,Recycle cleaning
1150805313,recycle_cleaning,https://gcms.labrulez.com/webinars?tags=11,gcms.labrulez.com,GCMS webinars focusing on Pyrolysis,Recycle cleaning
1150805313,recycle_cleaning,https://www.alamy.com/stock-photo/microplastic.html,www.alamy.com,Microplastic hi-res stock photography and images - Alamy,Recycle cleaning
1152189880,recycle_cleaning,https://blog.cleanhub.com/extended-producer-responsibility-philippines,blog.cleanhub.com,How Does Extended Producer Responsibility Work in the Philippines?,Recycle cleaning
1152189880,recycle_cleaning,https://skyhouse.md/?o=38-eco-friendly-products-that-are-sustainable-green-cc-YGyzzOsZ,skyhouse.md,38 Eco-Friendly Products That Are Sustainable GREEN! - SkyHouse,Recycle cleaning
1152189880,recycle_cleaning,https://www.epa.nsw.gov.au/news/media-releases/2022/epamedia220921-new-strategies-to-reduce-litter-and-illegal-dumping,www.epa.nsw.gov.au,New strategies to reduce litter and illegal dumping - NSW EPA,Recycle cleaning
1152189880,recycle_cleaning,https://www.instagram.com/creatingcenterpanama/?hl=en,www.instagram.com,The Creating Center (@creatingcenterpanama) - Instagram,Recycle cleaning
1152189880,recycle_cleaning,https://www.linkedin.com/posts/the-pilot-pen-company-uk-ltd_pilotpen-pilotpenuk-b2p-activity-7134816930195988480-rNHd,www.linkedin.com,The Pilot Pen Company (UK) Ltd on LinkedIn,Recycle cleaning
1331594926,waste_beach,https://cottontoday.cottoninc.com/why-fashion-needs-effort-to-be-plastic-free/,cottontoday.cottoninc.com,Why Fashion Needs to Make a Bigger Effort to Be “Plastic Free”,Waste beach
1331594926,waste_beach,https://lifestylemonitor.cottoninc.com/why-fashion-needs-to-make-a-bigger-effort-to-be-plastic-free/,lifestylemonitor.cottoninc.com,Why Fashion Needs to Make a Bigger Effort to Be “Plastic Free”,Waste beach
1331594926,waste_beach,https://sourcingjournal.com/topics/lifestyle-monitor/fashion-polyester-plastic-free-july-microplastics-cotton-incorporated-synthetic-fibers-446538/,sourcingjournal.com,Why Fashion Needs to Make a Bigger Effort to Be 'Plastic Free',Waste beach
1331594926,waste_beach,https://lifestylemonitor.cottoninc.com/how-fashion-can-give-the-people-what-they-want/,lifestylemonitor.cottoninc.com,How Fashion Can Give the People What They Want,Waste beach
1331594926,waste_beach,https://monosuit.com/pages/eco-monoskin,monosuit.com,ECO Monoskin by Monosuit,Waste beach
1331594926,waste_beach,https://hactoendplasticpollution.org/webinar-on-3-april-eliminate-and-restrict-hazardous-chemicals-and-intentionally-added-microplastics/,hactoendplasticpollution.org,Webinar on 3 April: Eliminate and restrict hazardous chemicals and ...,Waste beach
1331594926,waste_beach,https://www.linkedin.com/posts/lisa-cunningham-sherret-407194159_why-fashion-needs-to-make-a-bigger-effort-activity-7099683254470856704-sI9i,www.linkedin.com,Lisa Cunningham-Sherret's Post - LinkedIn,Waste beach
1208182476,waste_beach,https://www.texasdisposal.com/blog/ocean-pollution-causes-effects-and-prevention/,www.texasdisposal.com,"Ocean Pollution: Causes, Effects, Prevention | TDS",Waste beach
1208182476,waste_beach,https://wtop.com/lifestyle/2023/07/we-shouldnt-be-swimming-in-poopy-water-report-highlights-unsafe-us-beach-pollution-levels/,wtop.com,'We shouldn't be swimming in poopy water': Report highlights unsafe ...,Waste beach
1208182476,waste_beach,https://carrosone.be/plastic-bag-bottles-beach-seashore-water-pollution-concept-trash-vv-qkqxQzi7,carrosone.be,Plastic Bag Bottles Beach Seashore Water Pollution Concept,Waste beach
1073171494,waste_underwater,https://www.imperial.ac.uk/medicine/departments/school-public-health/environmental-research-group/research/microplastics/microplastic-exposure-and-human-health/,www.imperial.ac.uk,Microplastic Exposure and Human Health - Imperial College London,Waste underwater
1073171494,waste_underwater,https://www.imperial.ac.uk/medicine/departments/school-public-health/environmental-research-group/projects/,www.imperial.ac.uk,Projects | Faculty of Medicine | Imperial College London,Waste underwater
1073171494,waste_underwater,https://www.acorecycling.com/microplastics-a-hidden-threat-to-the-environment-and-human-health/,www.acorecycling.com,Microplastics: A Hidden Threat to the Environment and Human Health,Waste underwater
1073171494,waste_underwater,https://www.hajim.rochester.edu/senior-design-day/using-raman-analysis-to-identify-microplastics-in-environmental-samples/,www.hajim.rochester.edu,Using Raman Analysis to Identify Microplastics in Environmental ...,Waste underwater
1073171494,waste_underwater,https://www.thedailystar.net/environment/news/plastic-most-lethal-among-all-waste-3337746,www.thedailystar.net,Plastic most lethal among all waste | The Daily Star,Waste underwater
1073171494,waste_underwater,https://www.sulapac.com/blog/sustainable-alternatives-to-pet/,www.sulapac.com,Is recycled PET really the best you can do? - Sulapac,Waste underwater
1073171494,waste_underwater,https://www.linkedin.com/posts/rachel-lincoln-sarnoff_a-new-enzyme-found-in-compost-just-set-a-activity-6937870514736562176-RNNJ?trk=public_profile_like_view,www.linkedin.com,Rachel Lincoln Sarnoff on LinkedIn: A New Enzyme Found in ...,Waste underwater
1175409485,waste_underwater,https://www.innovationnewsnetwork.com/study-confirms-abundance-ocean-microplastic-pollution/17461/,www.innovationnewsnetwork.com,New study confirms abundance of ocean microplastic pollution,Waste underwater
1175409485,waste_underwater,https://comisiones.senado.gob.mx/ambiente/reu/docs/presentacion4_e170221.pdf,comisiones.senado.gob.mx,DRA. CRISTINA AYALA-AZCÁRRAGA,Waste underwater
1175409485,waste_underwater,https://marathi.abplive.com/photo-gallery/lifestyle/microplastics-are-in-our-bodies-microplastic-harms-human-body-how-it-affects-human-health-1151547,marathi.abplive.com,"सावधान! नकळतपणे तुम्ही दररोज प्लास्टिक खाताय, आरोग्यावर होईल गंभीर ...",Waste underwater
1211649774,plastic_in_food,https://www.theguardian.com/lifeandstyle/2023/jul/10/air-drinking-water-dust-food-how-to-reduce-exposure-microplastics,www.theguardian.com,"'They're in the air, drinking water, dust, food …' How to reduce your ...",Plastic in food
1211649774,plastic_in_food,https://ilsi.eu/scientific-activities/food-safety/ilsi-europe-initiative-on-microplastics-new/,ilsi.eu,Microplastics Initiative - ILSI Europe,Plastic in food
1211649774,plastic_in_food,https://www.thedailystar.net/opinion/editorial/news/we-cannot-ignore-the-threat-microplastics-3533686,www.thedailystar.net,We cannot ignore the threat of microplastics | The Daily Star,Plastic in food
1211649774,plastic_in_food,https://www.theengineer.co.uk/content/news/matter-raises-10m-to-scale-microplastic-filtration-tech/,www.theengineer.co.uk,Matter raises $10m to scale microplastic filtration tech - The Engineer,Plastic in food
1211649774,plastic_in_food,https://newatlas.com/medical/microplastics-trigger-brain-inflammation-found-in-heart-tissue/,newatlas.com,"Microplastics trigger brain inflammation, found in heart tissue",Plastic in food
1211649774,plastic_in_food,https://newatlas.com/tag/microplastic/,newatlas.com,Microplastic - New Atlas,Plastic in food
1211649774,plastic_in_food,https://www.linkedin.com/posts/axeldarut_according-to-the-breaking-the-plastic-wave-activity-7120660201870876672-EiHU,www.linkedin.com,Axel Darut on LinkedIn: According to the ''breaking the plastic wave ...,Plastic in food
1189450395,plastic_in_food,https://timesofindia.indiatimes.com/life-style/spotlight/how-microplastics-are-harmful-for-humans/photostory/102203774.cms,timesofindia.indiatimes.com,How microplastics are harmful for humans | Times of India - IndiaTimes,Plastic in food
1189450395,plastic_in_food,https://www.dailymail.co.uk/sciencetech/fb-5474125/WHAT-MICROPLASTICS-HUMAN-BODY-END-UP.html,www.dailymail.co.uk,WHAT CAN MICROPLASTICS DO TO THE HUMAN BODY?,Plastic in food
1189450395,plastic_in_food,https://farinhadaterraazambuja.com.br/?y=single-use-plastic-and-microplastics-regulations-%E2%80%93-critical-catalyst-ww-mEVL8rCj,farinhadaterraazambuja.com.br,"Single-use Plastic And Microplastics Regulations –, 47% OFF",Plastic in food
1296716316,plastic_in_food,https://www.biocodexmicrobiotainstitute.com/fr/pro/maladies-inflammatoires-chroniques-de-lintestin-mici-les-microplastiques-en-cause-dans-la-severite,www.biocodexmicrobiotainstitute.com,Maladies Inflammatoires Chroniques de l'Intestin (MICI),Plastic in food
1296716316,plastic_in_food,https://www.biocodexmicrobiotainstitute.com/pl/pro/nieswoiste-zapalenie-jelit-ibd-czy-plastik-moze-byc-przyczyna-nasilenia-choroby,www.biocodexmicrobiotainstitute.com,Nieswoiste zapalenie jelit (IBD): czy plastik może być przyczyną ...,Plastic in food
1296716316,plastic_in_food,https://wildfemininerising.se/pinguini-che-camminano-k.html,wildfemininerising.se,Spettacolo Cosiddetto Viaggio pinguini che camminano limo ...,Plastic in food
1184972195,fishes,https://www.technologynetworks.com/applied-sciences/news/ocean-nanoplastics-identified-for-the-first-time-383393,www.technologynetworks.com,Ocean Nanoplastics Identified for the First Time | Technology Networks,Fishes
1184972195,fishes,https://www.technologynetworks.com/applied-sciences/news/new-technology-can-remove-microplastics-from-water-with-94-efficiency-384793,www.technologynetworks.com,New Technology Can Remove Microplastics From Water With 94 ...,Fishes
1184972195,fishes,https://www.technologynetworks.com/tn/topic-hub/microplastics/news-and-features,www.technologynetworks.com,"Latest Microplastics News, Articles - Technology Networks",Fishes
1184972195,fishes,https://www.technologynetworks.com/analysis/news/8,www.technologynetworks.com,Analysis & Separations Science News | Page 8 - Technology Networks,Fishes
1184972195,fishes,https://www.packagingconnections.com/news/scientists-develop-eco-friendly-magnet-battle-microplastics.htm,www.packagingconnections.com,Scientists Develop Eco-Friendly “Magnet” To Battle Microplastics,Fishes
1313817688,fishes,https://www.savecoastalwildlife.org/microplastic-beach-research,www.savecoastalwildlife.org,Microplastic Beach Research - Save Coastal Wildlife,Fishes
1313817688,fishes,https://segpag.com.br/micro-plastic-in-fish-k.html,segpag.com.br,Rīt daudzsološs Noņemiet micro plastic in fish filozofija Zīmols Krogs,Fishes
1313817688,fishes,https://www.metalfiber.com.pe/micro-plastic-in-fish-k.html,www.metalfiber.com.pe,Zelené fazole Odhalit balón micro plastic in fish Závislý Předměstí ...,Fishes
1313817688,fishes,https://customcompounding.com.au/how-green-is-your-moisturiser/,customcompounding.com.au,How Green is Your Moisturiser? - NCC,Fishes
1166079178,fishes,https://opa-manni.de/,opa-manni.de,Opa Manni: Home,Fishes
1125896553,waste_land,https://www.umweltbundesamt.de/en/press/pressinformation/plastics-in-the-environment-transport-building,www.umweltbundesamt.de,"Plastics in the environment: Transport, building sectors and ...",Waste land
1125896553,waste_land,https://twitter.com/CIRFS_EU,twitter.com,CIRFS (@CIRFS_EU) / X,Waste land
1125896553,waste_land,https://depositphotos.com/photos/microplastic.html,depositphotos.com,Microplastic Stock Photos - Depositphotos,Waste land
1125896553,waste_land,https://depositphotos.com/photo/pollution-plastic-rendering-242704488.html,depositphotos.com,Pollution Plastic Rendering Stock Photo by ©Crevis 242704488,Waste land
1125896553,waste_land,https://www.umweltbundesamt.de/presse/pressemitteilungen/kunststoffe-in-der-umwelt-verkehr-bau,www.umweltbundesamt.de,"Kunststoffe in der Umwelt: Verkehr, Bau und Landwirtschaft größte ...",Waste land
1125896553,waste_land,https://depositphotos.com/ua/photos/microplastic.html,depositphotos.com,Стокові фотографії за запитом Microplastic - Depositphotos,Waste land
1125896553,waste_land,https://www.ohga.it/microplastiche-addosso-una-maglietta-sintetica-ogni-500-finisce-nellambiente/,www.ohga.it,Microplastiche addosso: una maglietta sintetica ogni 500 finisce nell ...,Waste land
1386894158,waste_land,https://asrc.gc.cuny.edu/headlines/2023/06/the-second-life-of-plastics/,asrc.gc.cuny.edu,The Second Life of Plastics - The Advanced Science Research Center,Waste land
1084693258,disposable_food,https://www.eunews.it/en/plastica-monouso-bando-dal-2021-via-posate-si-riciclo-bottiglie1-2/,www.eunews.it,plastica-monouso-bando-dal-2021-via-posate-si-riciclo-bottiglie1,Disposable food
1084693258,disposable_food,https://www173.rtaf.mi.th/?a=environment-positive-india-bans-single-use-plastic-the-stories-ff-kQR1W1hl,www173.rtaf.mi.th,"Environment Positive- India Bans Single-use Plastic The, 51% OFF",Disposable food
1084693258,disposable_food,https://www.linkedin.com/posts/kimber-mfg-inc._saluting-our-nations-heroes-and-those-who-activity-7129063472528543744-tJJv,www.linkedin.com,"Kimber Mfg., Inc. on LinkedIn: Saluting our nation's heroes and ...",Disposable food
1084693258,disposable_food,https://twitter.com/LAPPL/status/1613223162530959381?lang=en,twitter.com,"Los Angeles Police Protective League on X: ""We will display it ...",Disposable food
1084693258,disposable_food,https://www.ems1.com/video,www.ems1.com,EMS Videos - EMS1,Disposable food
1084693258,disposable_food,https://www.amazon.co.uk/Just-Time-America-Production-Strategy/dp/096219820X,www.amazon.co.uk,Just-In-Time for America: A Common Sense Production Strategy,Disposable food
1084693258,disposable_food,https://www.axios.com/local/detroit/2022/07/27/trump-endorsement-looms-over-foggy-gubernatorial-primary,www.axios.com,Trump endorsement looms over foggy gubernatorial primary - Axios,Disposable food
1226281053,disposable_food,https://www.cityofirvine.org/environmental-programs/single-use-plastics-ban,www.cityofirvine.org,Single-Use Plastics Ban | City of Irvine,Disposable food
1226281053,disposable_food,https://www.epa.nsw.gov.au/your-environment/plastics/exemptions,www.epa.nsw.gov.au,Plastics ban exemptions guidance - NSW EPA,Disposable food
1226281053,disposable_food,https://www.linkedin.com/pulse/how-do-single-use-plastic-bans-impact-your-business-facility-sharpe,www.linkedin.com,How do single-use plastic bans impact your business' facility supplies?,Disposable food
1226281053,disposable_food,https://www.countytimes.co.uk/news/23879044.single-use-plastic-ban-wales---need-know/,www.countytimes.co.uk,Single-use plastic ban in Wales - all you need to know - County Times,Disposable food
1193842698,disposable_food,https://coogeebeach.crowneplaza.com/cared-for-by-coogee/,coogeebeach.crowneplaza.com,Our Sustainability Journey IHG - Crowne Plaza Coogee Beach,Disposable food
1193842698,disposable_food,https://www.kaspioy.com/,www.kaspioy.com,Kaspioy – Fast Food & Restaurant Packaging Production,Disposable food