name,cluster,label,isSeed,seedRank,linksSeed,publishedAtUnix,publishedAtSQL,channelTitle,channelId,videoCategoryLabel,defaultLanguage,defaultAudioLanguage,viewCount,likeCount,dislikeCount,dislikeLikeRatio,favoriteCount,commentCount,thumb,language,clusterLabel
RRa6d_5CRT8,other,Ludovic  éboueur influenceur  va marcher 800 km de Paris à Marseille pour dépolluer la mythique N7,no,,no,1690956214,2023-08-02 06:08:34,Europe 1,UCIMGfEAERXjmWwQeg15BFsg,News & Politics,,,97,1,,,0,1,https://i.ytimg.com/vi/RRa6d_5CRT8/mqdefault.jpg,FR,Other
ziJcgBdbUXs,other,Robert Marchand  un centenaire champion de cyclisme,no,,no,1690953989,2023-08-02 05:08:29,Europe 1,UCIMGfEAERXjmWwQeg15BFsg,News & Politics,,,297,21,,,0,0,https://i.ytimg.com/vi/ziJcgBdbUXs/mqdefault.jpg,FR,Other
q1z8bsX73n8,other,La renaissance de Michel  atteint de la maladie de Parkinson,no,,no,1649081582,2022-04-04 14:04:02,AbbVie BeLux,UCOKV4r0BTUXO-gLGRtETk4w,People & Blogs,,en,10800,127,,,0,0,https://i.ytimg.com/vi/q1z8bsX73n8/mqdefault.jpg,FR,Other
Ur4eYnnCbD0,other,Hervé nous présente les footballeurs qui l inspirent,no,,no,1690516814,2023-07-28 04:07:14,20 Minutes France,UCD25QI36ly-8hWm9OPOz7aw,Music,,fr,297,2,,,0,0,https://i.ytimg.com/vi/Ur4eYnnCbD0/mqdefault.jpg,FR,Other
4I39-IScjp8,other,Taylor Swift  Coldplay... Le site Ticketmaster rend fou les fans,no,,no,1690896327,2023-08-01 13:08:27,20 Minutes France,UCD25QI36ly-8hWm9OPOz7aw,Entertainment,,,169,3,,,0,0,https://i.ytimg.com/vi/4I39-IScjp8/mqdefault.jpg,FR,Other
q2-Awz7kw8k,other,Un bipolaire en manie  ça fait quoi? Being manic  hoe does it feel?,no,,no,1622099212,2021-05-27 07:05:52,Michel Le Roux - Coaching Bipolar,UCTN9D_AmCQ66v7cWEuGWIJA,People & Blogs,,,3162,75,,,0,7,https://i.ytimg.com/vi/q2-Awz7kw8k/mqdefault.jpg,FR,Other
c0H7Wo3aTCo,other,Vivre avec le syndrome de la queue de cheval,no,,no,1669129888,2022-11-22 15:11:28,Saint-Augustin SA,UCG_m4MI2eSNR7q7jCdx5b8A,Education,fr,fr-CH,81246,370,,,0,32,https://i.ytimg.com/vi/c0H7Wo3aTCo/mqdefault.jpg,FR,Other
PBOCi_HJO7A,other,Présentation de GAYA - Simplifiez-vous la vi(ll)e.,no,,no,1685263375,2023-05-28 08:05:55,GAYA,UCZ6kuQLaMicxByG84fEvtQw,People & Blogs,,,216,0,,,0,0,https://i.ytimg.com/vi/PBOCi_HJO7A/mqdefault.jpg,FR,Other
I34C6LWR3qE,other,Château gonflable et barbecue gratuit : quand les dealers divertissent les cités,no,,no,1689955087,2023-07-21 15:07:07,Le Figaro,UCCDz_XYeKWd0OIyjp95dqyQ,News & Politics,fr-FR,fr-FR,5708,84,,,0,73,https://i.ytimg.com/vi/I34C6LWR3qE/mqdefault.jpg,FR,Other
du1f-mBypt4,other,Découverte | L inondation de mélasse de Boston,no,,no,1547509241,2019-01-14 23:01:41,Radio-Canada Info,UClxaaAzHu1B5EoTtBYea7ig,News & Politics,fr-CA,fr-CA,6918,,,,0,3,https://i.ytimg.com/vi/du1f-mBypt4/mqdefault.jpg,FR,Other
DQO3OqUnEFY,other,Un système qui puisse tenir le coût en fonction des crises,no,,no,1677518154,2023-02-27 17:02:54,AGRI72,UCw99cqLeAzl3IulRJO20VCg,Pets & Animals,fr,fr,3057,50,,,0,6,https://i.ytimg.com/vi/DQO3OqUnEFY/mqdefault.jpg,FR,Other
oRfu6uUhmcY,other,10 astuces pour lutter contre les pucerons -conseils anti-pucerons jardin Truffaut,no,,no,1434639449,2015-06-18 14:06:29,TRUFFAUT,UCVuUAN2z1tCH9yJiF1UbgoA,People & Blogs,,,123858,511,,,0,10,https://i.ytimg.com/vi/oRfu6uUhmcY/mqdefault.jpg,FR,Other
7YBn7BDULI4,other,COMMENT ÉLIMINER LES PUCERONS AU NATUREL,no,,no,1470761482,2016-08-09 16:08:22,newsjardintv,UCYsThm4HgSRy4nFyX871H1A,Howto & Style,,fr,595672,2226,,,0,298,https://i.ytimg.com/vi/7YBn7BDULI4/mqdefault.jpg,FR,Other
DuDbD2k62B4,other,Retenues d eau dans les Deux Sèvres : à quoi vont-elles servir exactement ?,no,,no,1679911390,2023-03-27 10:03:10,Agriculture et Environnement,UCxooxCiflBsJJ3PnGRg69jA,News & Politics,,fr,841,29,,,0,0,https://i.ytimg.com/vi/DuDbD2k62B4/mqdefault.jpg,FR,Other
boZj2R3A8nU,other,On se fait CAMBRIOLER notre VAN (la POLICE retrouve les voleurs mais... 😳),no,,no,1657558830,2022-07-11 17:07:30,Les Marioles Trotters,UCW-dQeNiTp8vSwHQpwdSHPg,Travel & Events,fr,fr,555750,13897,,,0,1391,https://i.ytimg.com/vi/boZj2R3A8nU/mqdefault.jpg,FR,Other
nx9oPOHQUsQ,other,Les taxes comportementales  un impôt régressif,no,,no,1690790435,2023-07-31 08:07:35,Le Point,UCQd5LYcykaFeZtjDaP3bNSA,News & Politics,,,1608,27,,,0,30,https://i.ytimg.com/vi/nx9oPOHQUsQ/mqdefault.jpg,FR,Other
7SyoCXpECv4,other,ARRACHAGES DE BETTERAVES BIO 2019 | SNC JACQUEL !,no,,no,1572627616,2019-11-01 17:11:16,LOAGRI,UCyrj0hUOWW7lGBYqq6eCPAQ,Autos & Vehicles,,,34529,1172,,,0,95,https://i.ytimg.com/vi/7SyoCXpECv4/mqdefault.jpg,FR,Other
Zyd8YheyRFY,other,Faut-il interdire les camions sur la RN10 ? - CLe Débat #2 avec Nicole Bonnefoy et Daniel Sauvaitre,no,,no,1670921208,2022-12-13 08:12:48,Charente Libre,UCuENvZBO2yApXWP71mIuk9w,News & Politics,,fr,244,3,,,0,5,https://i.ytimg.com/vi/Zyd8YheyRFY/mqdefault.jpg,FR,Other
BbWUtfnnHXg,other,Italie : limiter l accès au vacanciers sur les plages de Sardaigne pour préserver les écosystèmes,no,,no,1690905331,2023-08-01 15:08:31,FRANCE 24,UCCCPCZNChQdGa9EkATeye4g,News & Politics,fr,fr,3305,25,,,0,5,https://i.ytimg.com/vi/BbWUtfnnHXg/mqdefault.jpg,FR,Other
13stOHuPp3o,other,Pascal Lamy :  Je suis soulagé que Joe Biden nous ait débarrassés de Donald Trump,no,,no,1604909114,2020-11-09 08:11:14,FRANCE 24,UCCCPCZNChQdGa9EkATeye4g,News & Politics,,fr,17691,174,,,0,58,https://i.ytimg.com/vi/13stOHuPp3o/mqdefault.jpg,FR,Other
Fe4tNRsYCoo,other,[Webinaire] Lanceurs d alerte : le point sur la situation,no,,no,1646048754,2022-02-28 11:02:54,Oui à l innovation !,UCfTtn9BJ4oS_HdEmUDxHL_w,News & Politics,,fr,141,2,,,0,0,https://i.ytimg.com/vi/Fe4tNRsYCoo/mqdefault.jpg,FR,Other
cp8koHxWkmc,other,Urgent : il faut lutter contre le réchauffement climatique,no,,no,1690530619,2023-07-28 07:07:19,Oui à l innovation !,UCfTtn9BJ4oS_HdEmUDxHL_w,News & Politics,,fr,58,2,,,0,1,https://i.ytimg.com/vi/cp8koHxWkmc/mqdefault.jpg,FR,Other
rNo401zFkn8,other,Des technologies pour encourager son équipe... sans être présent au stade,no,,no,1597813504,2020-08-19 05:08:04,RMC,UCgGb7tN3tIH5_Kk05D1J_bA,Entertainment,,,489,9,,,0,4,https://i.ytimg.com/vi/rNo401zFkn8/mqdefault.jpg,FR,Other
m-MpZ0Em0Hg,other,Salaire des élus :  Devenir un élu est totalement volontaire ! Alors  qu ils assument !,no,,no,1690966774,2023-08-02 08:08:34,RMC,UCgGb7tN3tIH5_Kk05D1J_bA,Entertainment,,,829,9,,,0,8,https://i.ytimg.com/vi/m-MpZ0Em0Hg/mqdefault.jpg,FR,Other
ii63iQhoyY8,other,Drame à Wonderland :  Un toboggan  ça ne s envole pas à 50 km/h  il manque des informations…,no,,no,1690797530,2023-07-31 09:07:50,RMC,UCgGb7tN3tIH5_Kk05D1J_bA,Entertainment,,,6029,43,,,0,36,https://i.ytimg.com/vi/ii63iQhoyY8/mqdefault.jpg,FR,Other
Aez5b5iZuuw,other,Commerces - Visages des voleurs :  Il faudrait déjà que les voleurs soient punis par la justice…,no,,no,1690874894,2023-08-01 07:08:14,RMC,UCgGb7tN3tIH5_Kk05D1J_bA,Entertainment,,,11726,91,,,0,209,https://i.ytimg.com/vi/Aez5b5iZuuw/mqdefault.jpg,FR,Other
era2ZZ8WxzE,other,Amine  auditeur RMC :  On ne part pas en vacances pour la deuxième année,no,,no,1690531667,2023-07-28 08:07:47,RMC,UCgGb7tN3tIH5_Kk05D1J_bA,News & Politics,,,2809,23,,,0,45,https://i.ytimg.com/vi/era2ZZ8WxzE/mqdefault.jpg,FR,Other
-Uf2zldSniY,other,🔴 Prisca Thevenot  secrétaire d’Etat chargée de la jeunesse et du SNU  est notre invitée,no,,no,1690959682,2023-08-02 07:08:22,RMC,UCgGb7tN3tIH5_Kk05D1J_bA,Entertainment,fr,en-US,895,,,,0,22,https://i.ytimg.com/vi/-Uf2zldSniY/mqdefault.jpg,FR,Other
tC1QQFgk8mc,other,Colonies de vacances :  Ça coûte un petit 6000... Non  600 euros par semaine  excusez-moi !,no,,no,1690533504,2023-07-28 08:07:24,RMC,UCgGb7tN3tIH5_Kk05D1J_bA,Entertainment,,,3460,31,,,0,24,https://i.ytimg.com/vi/tC1QQFgk8mc/mqdefault.jpg,FR,Other
7P1479aS-k4,other,Ministre - Transition énergétique :  Pas envie de mettre 3 jours pour faire un Paris - Marseille !,no,,no,1690538382,2023-07-28 09:07:42,RMC,UCgGb7tN3tIH5_Kk05D1J_bA,Entertainment,,,5698,30,,,0,87,https://i.ytimg.com/vi/7P1479aS-k4/mqdefault.jpg,FR,Other
1IRQ4z98pZQ,other,LA FRAUDE AU FAUX CONSEILLER,no,,no,1647528473,2022-03-17 14:03:53,Banque Populaire Auvergne Rhône Alpes,UC2vCivvbd_tPKLQ6MWb0xVw,Travel & Events,fr,fr,1991,12,,,0,0,https://i.ytimg.com/vi/1IRQ4z98pZQ/mqdefault.jpg,FR,Other
hfI_c12YyPM,other,Ensilage d herbe chez un voisin !,no,,no,1619798426,2021-04-30 16:04:26,MarcA2C,UCZ9yHrfKO1gHp5kX-5tjJ0w,People & Blogs,,fr,75900,3489,,,0,110,https://i.ytimg.com/vi/hfI_c12YyPM/mqdefault.jpg,FR,Other
jr13hPPxT0A,other,L Alsace et les maisons alsaciennes avec Delphine Wespiser,no,,no,1579723251,2020-01-22 20:01:51,BFM Alsace,UCCvhE7Q2nK7ZVPXXaB6sgTA,People & Blogs,,en-US,5597,26,,,0,0,https://i.ytimg.com/vi/jr13hPPxT0A/mqdefault.jpg,FR,Other
1TJb72NwdQw,other,🕳️ [Christophe Galfard] Des trous noirs à l origine de l’Univers,no,,no,1545173881,2018-12-18 22:12:01,Espace des sciences,UClDk0iyj99stPxD9NQUaVSQ,Science & Technology,,fr,4601789,12693,,,0,1955,https://i.ytimg.com/vi/1TJb72NwdQw/mqdefault.jpg,FR,Other
VTaXwANmdpc,other,Norvège  sur la route des fjords,no,,no,1510005601,2017-11-06 22:11:01,Faut Pas Rêver - Officiel,UCsZ9Fu8d-AjN3pGRgVPcbcw,Travel & Events,,fr,1804262,6207,,,0,404,https://i.ytimg.com/vi/VTaXwANmdpc/mqdefault.jpg,FR,Other
rtzYbp4lyqo,other,Secrets d histoire - Voltaire ou la liberté de penser (Intégrale),no,,no,1562928440,2019-07-12 10:07:20,Secrets d Histoire Officiel,UC38MST1QfDAypgrjjr6FPBw,Entertainment,,fr,2022780,14821,,,0,1282,https://i.ytimg.com/vi/rtzYbp4lyqo/mqdefault.jpg,FR,Other
_6HWKQ1q4p0,other,Secrets d histoire - Léonard de Vinci  le génie sans frontières,no,,no,1571824278,2019-10-23 09:10:18,Secrets d Histoire Officiel,UC38MST1QfDAypgrjjr6FPBw,Entertainment,,fr,5291209,25395,,,0,1359,https://i.ytimg.com/vi/_6HWKQ1q4p0/mqdefault.jpg,FR,Other
3NO-MHHE64o,other,USA : être pauvre au pays le plus riche du monde,no,,no,1684522808,2023-05-19 19:05:08,Investigations et Enquêtes,UC50uCdUubc04xXZz7bqv5ng,Entertainment,fr,fr,1123681,11957,,,0,1538,https://i.ytimg.com/vi/3NO-MHHE64o/mqdefault.jpg,FR,Other
ACn_SWYO-84,other,☀️[Roland Lehoucq] Pourquoi le Soleil brille,no,,no,1613507313,2021-02-16 20:02:33,Espace des sciences,UClDk0iyj99stPxD9NQUaVSQ,Science & Technology,,fr,362088,2686,,,0,233,https://i.ytimg.com/vi/ACn_SWYO-84/mqdefault.jpg,FR,Other
Y8hXkj0IVIs,other,En Béarn  des ingénieurs analysent le mildiou pour lutter contre ses effets dévastateurs,no,,no,1690466766,2023-07-27 14:07:06,France 3 Nouvelle-Aquitaine,UCwTvW0qRQXV-yvBghNVgqKg,Travel & Events,,fr-FR,649,7,,,0,,https://i.ytimg.com/vi/Y8hXkj0IVIs/mqdefault.jpg,FR,Other
IzOxNh6PyuE,other,🎒 Ne jetez plus vos vieux cartables !,no,,no,1690657210,2023-07-29 19:07:10,France 3 Nouvelle-Aquitaine,UCwTvW0qRQXV-yvBghNVgqKg,Travel & Events,,fr-FR,315,11,,,0,,https://i.ytimg.com/vi/IzOxNh6PyuE/mqdefault.jpg,FR,Other
Clmfk3EEURw,other,Maxange : quand une grotte fait basculer le destin d une famille,no,,no,1690474901,2023-07-27 16:07:41,France 3 Nouvelle-Aquitaine,UCwTvW0qRQXV-yvBghNVgqKg,Pets & Animals,,fr-FR,885,11,,,0,,https://i.ytimg.com/vi/Clmfk3EEURw/mqdefault.jpg,FR,Other
aRIBkYgjQFo,other,Béarn : disparition du militant Jean Ortiz,no,,no,1690966821,2023-08-02 09:08:21,France 3 Nouvelle-Aquitaine,UCwTvW0qRQXV-yvBghNVgqKg,Howto & Style,,fr-FR,29,1,,,0,,https://i.ytimg.com/vi/aRIBkYgjQFo/mqdefault.jpg,FR,Other
OvzD0aiEMqY,other,✅ 🤙 Connaissez-vous la Pumptrack de Brive ?,no,,no,1690570809,2023-07-28 19:07:09,France 3 Nouvelle-Aquitaine,UCwTvW0qRQXV-yvBghNVgqKg,Travel & Events,,fr-FR,250,8,,,0,,https://i.ytimg.com/vi/OvzD0aiEMqY/mqdefault.jpg,FR,Other
fZ3a4MhGRdw,other,Barre de danse avec le danseur étoile Karl Paquette sur la plage de Royan,no,,no,1690480465,2023-07-27 17:07:25,France 3 Nouvelle-Aquitaine,UCwTvW0qRQXV-yvBghNVgqKg,Entertainment,,fr-FR,604,7,,,0,,https://i.ytimg.com/vi/fZ3a4MhGRdw/mqdefault.jpg,FR,Other
rMi8nRVv7S0,other,Série  Prendre l air  : à la découverte de Saint-Savin dans la Vienne,no,,no,1690552734,2023-07-28 13:07:54,France 3 Nouvelle-Aquitaine,UCwTvW0qRQXV-yvBghNVgqKg,Howto & Style,,fr-FR,425,19,,,0,,https://i.ytimg.com/vi/rMi8nRVv7S0/mqdefault.jpg,FR,Other
EVZ_hbe9SEk,other,À Dijon  vous pouvez immortaliser votre iris,no,,no,1690304732,2023-07-25 17:07:32,France 3 Bourgogne-Franche-Comté,UCMPIMCKpq5TRd92Jwj2D7_Q,News & Politics,fr,fr,593,19,,,0,,https://i.ytimg.com/vi/EVZ_hbe9SEk/mqdefault.jpg,FR,Other
16HCnr2mvpA,other,Au lac de Saint-Agnan dans le Morvan :  Des gens annulent à cause des cyanobactéries,no,,no,1689956272,2023-07-21 16:07:52,France 3 Bourgogne-Franche-Comté,UCMPIMCKpq5TRd92Jwj2D7_Q,News & Politics,fr,fr,1937,14,,,0,,https://i.ytimg.com/vi/16HCnr2mvpA/mqdefault.jpg,FR,Other
ri48eTQb9tY,other,Fin de l aventure pour Sochaux en Ligue 2,no,,no,1690918116,2023-08-01 19:08:36,France 3 Bourgogne-Franche-Comté,UCMPIMCKpq5TRd92Jwj2D7_Q,News & Politics,fr,fr,1175,16,,,0,,https://i.ytimg.com/vi/ri48eTQb9tY/mqdefault.jpg,FR,Other
khZkV77L9oU,other,Vacances pas chères : sobriété et sérénité avec   Les Amis de la Nature  à Salins (Jura),no,,no,1690281559,2023-07-25 10:07:19,France 3 Bourgogne-Franche-Comté,UCMPIMCKpq5TRd92Jwj2D7_Q,News & Politics,fr,fr,1870,25,,,0,,https://i.ytimg.com/vi/khZkV77L9oU/mqdefault.jpg,FR,Other
r6DLIRVtfX4,other,Le Barboux : la toujours jolie colonie de vacances,no,,no,1690902656,2023-08-01 15:08:56,France 3 Bourgogne-Franche-Comté,UCMPIMCKpq5TRd92Jwj2D7_Q,News & Politics,fr,fr,371,11,,,0,,https://i.ytimg.com/vi/r6DLIRVtfX4/mqdefault.jpg,FR,Other
sh-y3mU1cKk,other,Concerto pour deux clowns  une partition musicale de haut vol !,no,,no,1592558044,2020-06-19 09:06:04,Temal Productions,UCdkA2a_XRmvpqzlqm1dPSzg,Entertainment,,,1726,4,,,0,0,https://i.ytimg.com/vi/sh-y3mU1cKk/mqdefault.jpg,FR,Other
K8k4HevfuAA,other,Les volumes de pulvérisation. Quelles incidences ? Techniques de pulvérisation vidéo N°5,no,,no,1678695715,2023-03-13 08:03:55,Sam  agriculteur indépendant,UCsfYh1a4wWMv-z_uczNOXEA,Science & Technology,,fr,9285,891,,,0,58,https://i.ytimg.com/vi/K8k4HevfuAA/mqdefault.jpg,FR,Other
CcGDUijsLKw,other,Jak uniknąć kleszczy? - Nauka. To lubię.,no,,no,1532620267,2018-07-26 15:07:07,Nauka. To Lubię,UCtcUMxUSMWUNBfOaKUv5cjg,Science & Technology,,,607945,18925,,,0,1114,https://i.ytimg.com/vi/CcGDUijsLKw/mqdefault.jpg,FR,Other
3LZ4wtYVB78,other,Czy miasta powinny się zmienić? 🤔 (a my razem z nimi?),no,,no,1645377300,2022-02-20 17:02:00,Kasia Gandor,UCUercAwR2To1Zx6GA6ZP2TQ,Education,pl,pl,142825,7617,,,0,528,https://i.ytimg.com/vi/3LZ4wtYVB78/mqdefault.jpg,FR,Other
REfAZqzedc4,other,Jak schłodzić dom? Naturalna klimatyzacja - sposoby na ekologiczne ochłodzenie domu - EkoŻul 15,no,,no,1656608430,2022-06-30 17:06:30,W Szumilesie,UCa93gWFdETnaPKYbZxbgzJQ,People & Blogs,pl,pl,134614,3507,,,0,430,https://i.ytimg.com/vi/REfAZqzedc4/mqdefault.jpg,FR,Other
yT_sHTd6hAY,other,Moda odzieżowa pierze nam mózgi - podarte dżinsy i goła kostka przy -20 stopniach,no,,no,1648058428,2022-03-23 18:03:28,W Szumilesie,UCa93gWFdETnaPKYbZxbgzJQ,People & Blogs,pl,pl,175285,8383,,,0,1972,https://i.ytimg.com/vi/yT_sHTd6hAY/mqdefault.jpg,FR,Other
ZEDYVIT4oLc,other,Beaucoup d’émotions pour ma dernière intervention au Senat,no,,no,1689674204,2023-07-18 09:07:44,Valérie Létard,UCYH5iG-PNlvXtaypQYg0ziA,Comedy,,,1104,13,,,0,0,https://i.ytimg.com/vi/ZEDYVIT4oLc/mqdefault.jpg,FR,Other
f2JXHgSnmIM,other,Pourquoi faut-il se méfier des QR codes ?,no,,no,1690704019,2023-07-30 08:07:19,RTL,UCzBoVtUqSyAyr0kF5ABW7gQ,News & Politics,,fr,2821,75,,,0,0,https://i.ytimg.com/vi/f2JXHgSnmIM/mqdefault.jpg,FR,Other
a9SJY9ppiFg,other,Harcelée  Amandine va pouvoir changer de collège !,no,,no,1690534801,2023-07-28 09:07:01,RTL,UCzBoVtUqSyAyr0kF5ABW7gQ,News & Politics,,fr,1759,41,,,0,3,https://i.ytimg.com/vi/a9SJY9ppiFg/mqdefault.jpg,FR,Other
MaXCoFcakKU,other,Faire son ménage après le dîner  la solution pour mieux dormir !,no,,no,1690623011,2023-07-29 09:07:11,RTL,UCzBoVtUqSyAyr0kF5ABW7gQ,News & Politics,,fr,15899,95,,,0,2,https://i.ytimg.com/vi/MaXCoFcakKU/mqdefault.jpg,FR,Other
oBTYdlSjiaw,other,Natasha St-Pier ne s attendait pas à cela en cours de biologie,no,,no,1690905638,2023-08-01 16:08:38,RTL,UCzBoVtUqSyAyr0kF5ABW7gQ,News & Politics,,fr,4080,67,,,0,2,https://i.ytimg.com/vi/oBTYdlSjiaw/mqdefault.jpg,FR,Other
cJqHbGEf14M,other,Tout savoir sur les chèques vacances,no,,no,1690794989,2023-07-31 09:07:29,RTL,UCzBoVtUqSyAyr0kF5ABW7gQ,News & Politics,,fr,2118,29,,,0,0,https://i.ytimg.com/vi/cJqHbGEf14M/mqdefault.jpg,FR,Other
dlZ-piye2cM,other,Les astuces de L. Ruquier pour reconnaître le côté cour et le côté jardin au théâtre,no,,no,1690819226,2023-07-31 16:07:26,RTL,UCzBoVtUqSyAyr0kF5ABW7gQ,News & Politics,,fr,6005,100,,,0,3,https://i.ytimg.com/vi/dlZ-piye2cM/mqdefault.jpg,FR,Other
nORihigbMfI,other,Pourquoi les cahiers de vacances ont un tel succès ?,no,,no,1690880975,2023-08-01 09:08:35,RTL,UCzBoVtUqSyAyr0kF5ABW7gQ,News & Politics,,fr,1032,22,,,0,0,https://i.ytimg.com/vi/nORihigbMfI/mqdefault.jpg,FR,Other
44u7zZgHtVc,other,Les mésaventures de Laurent Ruquier chez un disquaire américain,no,,no,1690559885,2023-07-28 15:07:05,RTL,UCzBoVtUqSyAyr0kF5ABW7gQ,News & Politics,,fr,24400,311,,,0,3,https://i.ytimg.com/vi/44u7zZgHtVc/mqdefault.jpg,FR,Other
0AN4n0W8rTU,other,Olivier Dauvers vous révèle l origine inattendue du nom du  groupe Casino,no,,no,1690718400,2023-07-30 12:07:00,RTL,UCzBoVtUqSyAyr0kF5ABW7gQ,News & Politics,,fr,7002,137,,,0,1,https://i.ytimg.com/vi/0AN4n0W8rTU/mqdefault.jpg,FR,Other
Wc9UwQ_TAoU,other,Episode n°9 La climatisation est elle vraiment bonne pour la santé ?,no,,no,1690890714,2023-08-01 11:08:54,RTL,UCzBoVtUqSyAyr0kF5ABW7gQ,News & Politics,,fr,1907,20,,,0,2,https://i.ytimg.com/vi/Wc9UwQ_TAoU/mqdefault.jpg,FR,Other
3vMYCW7gw1c,other,Jessie Inchauspé : Faire son ménage après le dîner  la solution pour mieux dormir,no,,no,1690614003,2023-07-29 07:07:03,RTL,UCzBoVtUqSyAyr0kF5ABW7gQ,News & Politics,,fr,2323,42,,,0,9,https://i.ytimg.com/vi/3vMYCW7gw1c/mqdefault.jpg,FR,Other
UCYr0BVnUwg,other,L entretien de vos appareils auditifs en 5 étapes faciles!,no,,no,1591041092,2020-06-01 19:06:32,Lobe.TV,UC8Nbq2TiCLj8J6u9yDafCmQ,Howto & Style,,fr-CA,14459,46,,,0,2,https://i.ytimg.com/vi/UCYr0BVnUwg/mqdefault.jpg,FR,Other
PDPLNtSCGDg,other,Quand l intelligence artificielle s occupe de vos cartes postales,no,,no,1690725615,2023-07-30 14:07:15,RTL,UCzBoVtUqSyAyr0kF5ABW7gQ,News & Politics,,fr,4070,54,,,0,4,https://i.ytimg.com/vi/PDPLNtSCGDg/mqdefault.jpg,FR,Other
QgBqROkqpp0,other,Devant 70 000 personnes  elles font vivre les concerts aux sourds et aux malentendants,no,,no,1690622101,2023-07-29 09:07:01,Brut,UCSKdvgqdnj72_SLggp7BDTg,Music,,fr,35025,635,,,0,72,https://i.ytimg.com/vi/QgBqROkqpp0/mqdefault.jpg,FR,Other
ThO8UTOGLrc,other,Pourquoi le cancer du pancréas se révèle par une jaunisse ?,no,,no,1465476639,2016-06-09 12:06:39,Institut de Cancérologie de l Ouest,UCCwRRwy8nBsIC0Axey68CKw,People & Blogs,,fr-FR,2412,4,,,0,0,https://i.ytimg.com/vi/ThO8UTOGLrc/mqdefault.jpg,FR,Other
Jc6t3XHpaF8,other,Un mec de gauche gifler une femme ? Je n y crois pas  - La chronique de Gaspard Proust,no,,no,1663743222,2022-09-21 06:09:42,Europe 1,UCIMGfEAERXjmWwQeg15BFsg,News & Politics,,,309522,3612,,,0,397,https://i.ytimg.com/vi/Jc6t3XHpaF8/mqdefault.jpg,FR,Other
Tn6c1_XxLHA,other,Les contraventions de voirie  outil de protection du domaine public routier,no,,no,1613138309,2021-02-12 13:02:29,Cabinet Landot & associés,UCNrG7PWLpfvBoBMHNnqMQSg,News & Politics,fr,fr,2266,32,,,0,4,https://i.ytimg.com/vi/Tn6c1_XxLHA/mqdefault.jpg,FR,Other
2PeezuPCAxs,other,Entretien avec Pascal Bruckner,no,,no,1610829481,2021-01-16 20:01:01,Parvis Espace Culturel,UC2LDd-OaUAoZcghQDEoxhmw,News & Politics,,fr,2643,40,,,0,4,https://i.ytimg.com/vi/2PeezuPCAxs/mqdefault.jpg,FR,Other
BfY_R-dbUG0,other,L’innovation au service de la protection de la Méditerranée,no,,no,1686237247,2023-06-08 15:06:07,Science & Vie,UCKbE7xjCnjKL6_imHvLRqWw,Science & Technology,,fr,42,3,,,0,0,https://i.ytimg.com/vi/BfY_R-dbUG0/mqdefault.jpg,FR,Other
FSymiztrtxI,other,Regardez la station spatiale internationale transiter devant le Soleil en vidéo !,no,,no,1686733263,2023-06-14 09:06:03,Science & Vie,UCKbE7xjCnjKL6_imHvLRqWw,Science & Technology,,fr,900,11,,,0,1,https://i.ytimg.com/vi/FSymiztrtxI/mqdefault.jpg,FR,Other
OZebAn_nD_8,other,Exploration du littoral marin en Corse et son BaroMed - Blue Odyssey Corsica X Science&Vie,no,,no,1689926417,2023-07-21 08:07:17,Science & Vie,UCKbE7xjCnjKL6_imHvLRqWw,Science & Technology,,fr,71,4,,,0,0,https://i.ytimg.com/vi/OZebAn_nD_8/mqdefault.jpg,FR,Other
0kzRof0qrhY,other,Le pollen : un super aliment méconnu !,no,,no,1580124866,2020-01-27 11:01:26,Samedi à tout prix,UCCuySJIvnUg7Zrbcvb4zlgg,Entertainment,,,1765,26,,,0,0,https://i.ytimg.com/vi/0kzRof0qrhY/mqdefault.jpg,FR,Other
bHp1gwmdziE,other,L épicerie | Le nouvel étiquetage sur les aliments transformés,no,,no,1674232429,2023-01-20 16:01:49,Radio-Canada Info,UClxaaAzHu1B5EoTtBYea7ig,News & Politics,fr-CA,fr-CA,15268,,,,0,24,https://i.ytimg.com/vi/bHp1gwmdziE/mqdefault.jpg,FR,Other
XgVC9gw9WDs,other,Marche pour le Climat le 9 avril 2022,no,,no,1649235459,2022-04-06 08:04:39,Générations Futures,UC5ma2JwI7oiquXcl-gzC3Jw,Howto & Style,,fr,260,6,,,0,0,https://i.ytimg.com/vi/XgVC9gw9WDs/mqdefault.jpg,FR,Other
-s129QaK7Fk,other,Des clopinettes pour les producteurs  des noix pour la MSA !,no,,no,1679477692,2023-03-22 09:03:52,Coordination Rurale,UCU61leTuAMuaDy7UN5PXZ7g,News & Politics,,fr,370,3,,,0,0,https://i.ytimg.com/vi/-s129QaK7Fk/mqdefault.jpg,FR,Other
1fONsRqlAF0,other,Les éleveurs laitiers devant le siège de Carrefour,no,,yes,1676391514,2023-02-14 16:02:34,Coordination Rurale,UCU61leTuAMuaDy7UN5PXZ7g,News & Politics,,fr,58,1,,,0,0,https://i.ytimg.com/vi/1fONsRqlAF0/mqdefault.jpg,FR,Other
dudLgpriB3k,other,Électricité  pouvoir d achat  mal-être agricole  bio...,no,,yes,1674056801,2023-01-18 15:01:41,Coordination Rurale,UCU61leTuAMuaDy7UN5PXZ7g,News & Politics,,fr,182,5,,,0,0,https://i.ytimg.com/vi/dudLgpriB3k/mqdefault.jpg,FR,Other
hTP_v-6dx10,other,Inflation : quels impacts sur l élevage caprin ?,no,,no,1677158460,2023-02-23 13:02:00,Coordination Rurale,UCU61leTuAMuaDy7UN5PXZ7g,News & Politics,,fr,22,0,,,0,0,https://i.ytimg.com/vi/hTP_v-6dx10/mqdefault.jpg,FR,Other
yXJtP2Gt9F0,other,Inflation : quels impacts sur les grandes cultures en bio ?,no,,no,1677158193,2023-02-23 13:02:33,Coordination Rurale,UCU61leTuAMuaDy7UN5PXZ7g,News & Politics,,fr,33,0,,,0,0,https://i.ytimg.com/vi/yXJtP2Gt9F0/mqdefault.jpg,FR,Other
GMNkpDYpkCQ,other,Innovations viticoles au salon Vini Viti Vici du Tarn,no,,no,1690217681,2023-07-24 16:07:41,France 3 Occitanie,UC20dglUTkVqzY9ipx_iOnng,News & Politics,fr,fr-FR,1500,,,,0,,https://i.ytimg.com/vi/GMNkpDYpkCQ/mqdefault.jpg,FR,Other
eWmihcjGa4k,other,Ad Oc : ils soignent leurs plantes avec de la musique grâce à la génodie,no,,no,1688743963,2023-07-07 15:07:43,France 3 Occitanie,UC20dglUTkVqzY9ipx_iOnng,News & Politics,fr,fr-FR,432,,,,0,,https://i.ytimg.com/vi/eWmihcjGa4k/mqdefault.jpg,FR,Other
kjNFYLhG_bc,other,Des fruits salvateurs,no,,no,1690957568,2023-08-02 06:08:08,Public Sénat,UCTa1bPArjpvNMgSHAb_pflA,News & Politics,,,248,15,,,0,1,https://i.ytimg.com/vi/kjNFYLhG_bc/mqdefault.jpg,FR,Other
FrrRR5dUdYg,other,Le vin de Bordeaux est-il en voie de disparition ?,no,,no,1689768015,2023-07-19 12:07:15,Le Figaro,UCCDz_XYeKWd0OIyjp95dqyQ,News & Politics,fr-FR,fr-FR,4405,52,,,0,19,https://i.ytimg.com/vi/FrrRR5dUdYg/mqdefault.jpg,FR,Other
JmYuquKZ7dk,other,Doit-on tailler les tomates qui poussent trop fort ?,no,,no,1656243210,2022-06-26 11:06:30,André Abrahami,UC0tMzNAPlPP9VglNamdO8sQ,Howto & Style,fr,fr,36437,1837,,,0,63,https://i.ytimg.com/vi/JmYuquKZ7dk/mqdefault.jpg,FR,Other
Fd3OeJTgf5U,other,Des produits bio gratuits... c est possible ! - Tout Compte Fait,no,,no,1506321060,2017-09-25 06:09:00,Tout Compte Fait,UC_4WpPcSfpxsSqA6hNpqJbg,Entertainment,,,265627,1982,,,0,263,https://i.ytimg.com/vi/Fd3OeJTgf5U/mqdefault.jpg,FR,Other
OPZqw6-4Oo8,other,Viticulture bordelaise : une révolution méconnue,no,,no,1637840190,2021-11-25 11:11:30,Oui à l innovation !,UCfTtn9BJ4oS_HdEmUDxHL_w,News & Politics,,fr,16249,105,,,0,3,https://i.ytimg.com/vi/OPZqw6-4Oo8/mqdefault.jpg,FR,Other
TL0lM3eR1q0,other,Comment expliquer la hausse importante du prix des fruits et légumes ?,no,,no,1690445907,2023-07-27 08:07:27,RMC,UCgGb7tN3tIH5_Kk05D1J_bA,News & Politics,,,1845,18,,,0,32,https://i.ytimg.com/vi/TL0lM3eR1q0/mqdefault.jpg,FR,Other
6WTSmlKoQHA,other,💰🐔 SALAIRE. Se payer en œufs frais !,no,,no,1690484408,2023-07-27 19:07:08,France 3 Nouvelle-Aquitaine,UCwTvW0qRQXV-yvBghNVgqKg,Travel & Events,,fr-FR,320,12,,,0,,https://i.ytimg.com/vi/6WTSmlKoQHA/mqdefault.jpg,FR,Other
CcJpJMWZPok,other,Actus N°11/2023 Les produits phytosanitaires en agriculture biologique. Alerte sur le bio....,no,,no,1686161593,2023-06-07 18:06:13,Sam  agriculteur indépendant,UCsfYh1a4wWMv-z_uczNOXEA,News & Politics,,fr,12836,1091,,,0,89,https://i.ytimg.com/vi/CcJpJMWZPok/mqdefault.jpg,FR,Other
NByYtASOR_w,other,Actualités N°7. L eau  l agriculture intensive  l agriculture bio  registre électronique en 2026 !,no,,no,1680861524,2023-04-07 09:04:44,Sam  agriculteur indépendant,UCsfYh1a4wWMv-z_uczNOXEA,News & Politics,,fr,10659,1306,,,0,124,https://i.ytimg.com/vi/NByYtASOR_w/mqdefault.jpg,FR,Other
SL8hUSW4SJs,other,Dans le Nord  les déchets alimentaires des entreprises vont au compost,no,,no,1690441215,2023-07-27 07:07:15,France 3 Hauts-de-France,UCFC3nJ8GXl5yONe3tB_vhsw,News & Politics,,fr,337,11,,,0,0,https://i.ytimg.com/vi/SL8hUSW4SJs/mqdefault.jpg,FR,Other
jY3GMuySLu8,other,Canicules et gelées tardives : comment cultiver quand il n’y a plus de saisons,no,,no,1624190415,2021-06-20 12:06:15,Le Monde,UCYpRDnhk5H8h16jpS84uqsA,News & Politics,fr,fr,222103,6450,,,0,544,https://i.ytimg.com/vi/jY3GMuySLu8/mqdefault.jpg,FR,Other
